{
  "$schema": "../../schemas/plugin-manifest.schema.json",
  "name": "resume_builder",
  "version": "0.1.0",
  "description": "Generate a master resume from the vault with no JD targeting; supports zh/en, academic/industry/research styles, one/two-page lengths, and markdown/docx/latex/jsonresume formats.",
  "type": "skill",
  "license": "MIT",
  "depends_on": ["schema@1.0.0"],
  "hooks": [],
  "mcp_tools": [],
  "permissions": {
    "read":  ["vault/career/**", "schemas/**", "prompts/**", "config/**"],
    "write": ["output/**"],
    "deny":  ["vault/career/** as write target", "vault/jobs/** as write target", "vault/.obsidian/**"]
  }
}
